[
  {
    "createTime": 1651856131126,
    "createdBy": "",
    "name": "image_compression",
    "description": "Edit or extend this sample task. Set the task name to get started",
    "retryCount": 3,
    "timeoutSeconds": 600,
    "inputKeys": [],
    "outputKeys": [],
    "timeoutPolicy": "ALERT_ONLY",
    "retryLogic": "FIXED",
    "retryDelaySeconds": 6,
    "responseTimeoutSeconds": 10,
    "inputTemplate": {},
    "rateLimitPerFrequency": 0,
    "rateLimitFrequencyInSeconds": 1,
    "ownerEmail": "test@orkes.io",
    "backoffScaleFactor": 1
  },
  {
    "createTime": 1651853134126,
    "createdBy": "",
    "name": "download_file_from_ec2",
    "description": "Edit or extend this sample task. Set the task name to get started",
    "retryCount": 1,
    "timeoutSeconds": 300,
    "inputKeys": [],
    "outputKeys": [],
    "timeoutPolicy": "TIME_OUT_WF",
    "retryLogic": "FIXED",
    "retryDelaySeconds": 3,
    "responseTimeoutSeconds": 50,
    "inputTemplate": {},
    "rateLimitPerFrequency": 0,
    "rateLimitFrequencyInSeconds": 1,
    "ownerEmail": "test@orkes.io",
    "backoffScaleFactor": 1
  },
  {
    "createTime": 1652856134126,
    "createdBy": "",
    "name": "update_database",
    "description": "Edit or extend this sample task. Set the task name to get started",
    "retryCount": 3,
    "timeoutSeconds": 900,
    "inputKeys": [],
    "outputKeys": [],
    "timeoutPolicy": "TIME_OUT_WF",
    "retryLogic": "FIXED",
    "retryDelaySeconds": 10,
    "responseTimeoutSeconds": 60,
    "inputTemplate": {},
    "rateLimitPerFrequency": 0,
    "rateLimitFrequencyInSeconds": 1,
    "ownerEmail": "test@orkes.io",
    "backoffScaleFactor": 1
  }
]