{
  "name": "fail_on_purpose",
  "description": "test",
  "retryCount": 2,
  "timeoutSeconds": 20,
  "inputKeys": [],
  "outputKeys": [],
  "timeoutPolicy": "RETRY",
  "retryLogic": "FIXED",
  "retryDelaySeconds": 1,
  "responseTimeoutSeconds": 2,
  "concurrentExecLimit": 0,
  "inputTemplate": {},
  "rateLimitPerFrequency": 0,
  "rateLimitFrequencyInSeconds": 1,
  "pollTimeoutSeconds": 3600,
  "backoffScaleFactor": 1,
  "ownerEmail": "test@conductor.io"
}
